NO,NAMA KAMERA,LOKASI,RINCIAN LOKASI,X_KOOR,Y_KOOR,JARINGAN,NVR,MERK,MODEL
534,NGINDEN BRATANG SELATAN FIX,SIMPANG,Simpang Nginden - Bratang Hadap Selatan,112.7620226,-7.299566623,KOMINFO,TIMUR,HIKVISION,DS-2CD4232FWD-IZS
535,NGINDEN PANJANG JIWO UTARA FIX ,SIMPANG,Simpang Nginden - Panjang Jiwo Hadap Utara,112.761893,-7.306562,KOMINFO,TIMUR,HIKVISION,DS-2CD6986F-H
536,NGINDEN  PANJANG JIWO BARAT PTZ,SIMPANG,Simpang Nginden - Panjang Jiwo Hadap Barat,112.761893,-7.306562,KOMINFO,TIMUR,HIKVISION,DS-2DY3320IW-DE
537,NGINDEN  PANJANG JIWO SELATAN FIX,SIMPANG,Simpang Nginden - Panjang Jiwo Hadap Selatan,"112,761,602","-7,306,624",KOMINFO,TIMUR,Unidentified,Unidentified
538,KLAMPIS JAYA UTARA FIX,SIMPANG,Simpang Klampis Jaya - Arief Rahman Hakim Hadap Utara,112.7754221,-7.289656925,TELKOM,TIMUR,HIKVISION,MVS-414232-IRMVF
539,KLAMPIS JAYA TIMUR PTZ,SIMPANG,Simpang Klampis Jaya - Arief Rahman Hakim Hadap Timur,112.7753193,-7.28964739,TELKOM,TIMUR,HIKVISION,DS-2DY3320IW-DE
540,KLAMPIS JAYA SELATAN PTZ,SIMPANG,Simpang Klampis Jaya - Arief Rahman Hakim Hadap Selatan,112.7753027,-7.289444843,TELKOM,TIMUR,HIKVISION,DS-2DY3320IW-DE
541,PANJANG JIWO KEDUNG BARUK SELATAN FIX ,SIMPANG,Simpang Kalirungkut - Panjang Jiwo Kedung Baruk  Hadap  Selatan,112.7699376,-7.30879794,KOMINFO,TIMUR,HIKVISION,DS-2CD4232FWD-IZS
542,PANJANG JIWO KEDUNG BARUK TIMUR FIX ,SIMPANG,Simpang Kalirungkut - Panjang Jiwo Kedung Baruk  Hadap Timur,112.769754,-7.308748,KOMINFO,TIMUR,HIKVISION,DS-2CD4232FWD-IZS
543,PANJANG JIWO KEDUNG BARUK BARAT FIX,SIMPANG,Simpang Kalirungkut - Panjang Jiwo Kedung Baruk  Hadap  Barat,112.769655,-7.308793,KOMINFO,TIMUR,HIKVISION,DS-2CD4232FWD-IZS
544,RUNGKUT MADYA UTARA FIX ,SIMPANG,Simpang Rungkut Madya - Rungkut Mapan Hadap Utara,112.7599343,-7.293887886,TELKOM,TIMUR,HIKVISION,MVS-414232-IRMVF
545,RUNGKUT MADYA TIMUR FIX ,SIMPANG,Simpang Rungkut Madya - Rungkut Mapan Hadap Timur,112.7597962,-7.293670621,TELKOM,TIMUR,HIKVISION,MVS-414232-IRMVF
546,RUNGKUT MADYA BARAT FIX ,SIMPANG,Unidentified,"112,775,277","-7,331,560",TELKOM,TIMUR,Unidentified,Unidentified
547,RUNGKUT INDUSTRI TIMUR FIX,SIMPANG,Simpang Rungkut Industri - Kalirungkut Hadap Timur,"112,751,381","-7,329,691",TELKOM,TIMUR,Unidentified,Unidentified
548,RUNGKUT INDUSTRI BARAT FIX,SIMPANG,Simpang Rungkut Industri - Kalirungkut Hadap Barat,112.75117,-7.329506,TELKOM,TIMUR,MAGIC VISION,MVS-414232-IRMVF
549,RUNGKUT INDUSTRI DOME,SIMPANG,Simpang Rungkut Industri - Kalirungkut,112.751157,-7.329567,TELKOM,TIMUR,MAGIC VISION,MS-91021-IR-SD-OD
550,RUNGKUT PONDOK CHANDRA PTZ,RUAS,Perbatasan Rungkut - Pondok Candra,112.7679346,-7.341756831,TELKOM,TIMUR,HIKVISION,DS-2DY3320IW-DE
551,JEMUR ANDAYANI KENDANGSARI TIMUR FIX,SIMPANG,Simpang Kendang Sari - Jemur Andayani (hadap timur),112.744599,-7.329191,TELKOM,TIMUR,HIKVISION,MVS-414232-IRMVF
552,JEMUR ANDAYANI KENDANGSARI PANO,SIMPANG,Simpang Kendang Sari - Jemur Andayani,112.744808,-7.329284,TELKOM,TIMUR,HIKVISION,MVS-414232-IRMVF
553,JEMUR ANDAYANI KENDANGSARI BARAT FIX,SIMPANG,Simpang Kendang Sari - Jemur Andayani (hadap Barat),112.744808,-7.329284,TELKOM,TIMUR,Unidentified,Unidentified
554,KECAMATAN RUNGKUT PANO,SIMPANG,Pertigaan Rungkut Soponyono Kecamatan,112.770766,-7.322505,TELKOM,TIMUR,HIKVISION,DS-2CD6986F-H
555,BUNDARAN ITS PTZ,RUAS,Bundaran ITS Sisi Pakuwon,112.798183,-7.274459306,TELKOM,TIMUR,HIKVISION,DS-2DY3320IW-DE
556,MERR PIZZA HUT PTZ,RUAS,Jl. Ir. Soekarno (Merr Kedung Baruk Depan Pizza Hut),112.780819,-7.31721,TELKOM,TIMUR,Unidentified,Unidentified
557,PCTL MERR SEMAMPIR UTARA FIX,RUAS,PCTL Jl. Ir. Soekarno (Merr Semampir),112.780519,-7.307234,TELKOM,TIMUR,Unidentified,Unidentified
558,PCTL MERR SEMAMPIR SELATAN FIX,RUAS,PCTL Jl. Ir. Soekarno (Merr Semampir),112.780519,-7.307234,TELKOM,TIMUR,Unidentified,Unidentified
559,DIPONEGORO SOETOMO UTARA SPC,SIMPANG,Unidentified,"112,733,338","-7,284,595",KOMINFO,TIMUR,Unidentified,Unidentified
560,PINTU MASUK GBT HADAP SELATAN,OBJEK VITAL,Unidentified,"112,617,769","-7,222,195",KOMINFO,TIMUR,Unidentified,Unidentified
561,PINTU MASUK GBT HADAP UTARA,OBJEK VITAL,Unidentified,"112,617,702","-7,222,222",KOMINFO,TIMUR,Unidentified,Unidentified
562,KRANGGAN BARAT PARKIR,RUAS,Unidentified,"112,733,357","-7,255,930",TELKOM,TIMUR,Unidentified,Unidentified
563,KRANGGAN SELATAN PARKIR,RUAS,Unidentified,"112,733,609","-7,255,943",TELKOM,TIMUR,Unidentified,Unidentified
564,KRANGGAN TIMUR PARKIR,RUAS,Unidentified,"112,734,071","-7,255,967",TELKOM,TIMUR,Unidentified,Unidentified
565,JIMERTO BARAT PARKIR,RUAS,Unidentified,112.748072,-7.258118,KOMINFO,TIMUR,Unidentified,Unidentified
566,JIMERTO TIMUR PARKIR ,RUAS,Unidentified,112.748072,-7.258118,KOMINFO,TIMUR,Unidentified,Unidentified
567,JIMERTO SELATAN PARKIR ,RUAS,Unidentified,112.748072,-7.258118,KOMINFO,TIMUR,Unidentified,Unidentified
568,JIMERTO PARKIR MOBIL,RUAS,Unidentified,112.748072,-7.258118,KOMINFO,TIMUR,Unidentified,Unidentified
569,JIMERTO BARAT PARKIR,RUAS,Unidentified,112.748072,-7.258118,KOMINFO,TIMUR,Unidentified,Unidentified
570,SEDAP MALAM PARKIR ,RUAS,Unidentified,112.748072,-7.258118,KOMINFO,TIMUR,Unidentified,Unidentified
571,SEDAP MALAM PARKIR 1,RUAS,Unidentified,112.747299,-7.260794,KOMINFO,TIMUR,Unidentified,Unidentified
572,SEDAP MALAM PARKIR 2,RUAS,Unidentified,112.747299,-7.260794,KOMINFO,TIMUR,Unidentified,Unidentified
573,SEDAP MALAM PARKIR 3,RUAS,Unidentified,112.747299,-7.260794,KOMINFO,TIMUR,Unidentified,Unidentified
574,KEMBANG JEPUN KYAKYA BARAT PARKIR,RUAS,Unidentified,112.744745,-7.238402,TELKOM,TIMUR,Unidentified,Unidentified
575,JEMBATAN MERAH PARKIR,RUAS,Unidentified,112.738466,-7236636,TELKOM,TIMUR,Unidentified,Unidentified
576,KAPASAN HADAP TIMUR PARKIR,RUAS,Unidentified,112.745247,-7.238598,TELKOM,TIMUR,Unidentified,Unidentified
577,U TURN MERR KONI DEPAN GALAXY MALL HADAP SELATAN PTZ,RUAS,Unidentified,112.780897,-7.2783335,TELKOM,TIMUR,HIKVISION,Unidentified
578,PCTL AHMAD YANI DOLOG PTZ,RUAS,Unidentified,112.73212555,-7.32638323,TELKOM,SELATAN,HIKVISION,Unidentified
579,SRIKANA PANO,SIMPANG,Unidentified,112.7563105,-7.2738896,TELKOM,TIMUR,HIKVISION,Unidentified
580,SRIKANA SPC,SIMPANG,Unidentified,112.7563105,-7.2738896,TELKOM,TIMUR,SPC,Unidentified
