NO,NAMA KAMERA,LOKASI,RINCIAN LOKASI,X_KOOR,Y_KOOR,JARINGAN,NVR,MERK,MODEL
1,BUNDARAN WARU PTZ,RUAS,Bundaran Waru arah keluar kota,112.7292683,-7.345983874,KOMINFO,SELATAN,HIKVISION,DS-2DY3320IW-DE
2,BUNDARAN WARU ARAH TOL PTZ,RUAS,Bundaran Waru arah masuk tol,112.7275055,-7.347602778,TELKOM,SELATAN,HIKVISION,DS-2DY3320IW-DE
3,BUNDARAN WARU CITO PTZ,RUAS,Bundaran Waru depan CITO arah masuk kota,"112,728,923","-7,345,673",KOMINFO,SELATAN,Unidentified,Unidentified
4,DUKUH MENANGGAL BUNDARAN WARU,RUAS,Unidentified,"112,725,053","-7,346,578",KOMINFO,SELATAN,Unidentified,Unidentified
5,BUNDARAN WARU,RUAS,Unidentified,"112,727,899","-7,347,716",TELKOM,SELATAN,Unidentified,Unidentified
6,FRONTAGE A.YANI CAREFOUR,RUAS,Frontage Ahmad Yani Depan Trans Icon Hadap Utara,"112,729,174","-7,339,572",KOMINFO,SELATAN,HIKVISION,DS-2DY3320IW-DE
7,GAYUNGSARI BARAT SISI UTARA FIX,SIMPANG,Simpang Gayungsari Barat Hadap Utara,112.7191119,-7.337361047,TELKOM,SELATAN,HIKVISION,DS-2DY3320IW-DE
8,GAYUNGSARI BARAT SISI SELATAN FIX,SIMPANG,Simpang Gayungsari Barat Hadap Selatan,112.718958,-7.33753694,TELKOM,SELATAN,HIKVISION,DS-2DY3320IW-DE
9,GAYUNGSARI BARAT SISI BARAT FIX,SIMPANG,Simpang Gayungsari Barat Hadap Barat,112.7191123,-7.337487081,TELKOM,SELATAN,HIKVISION,MVS-414232-IRMVF
10,MASJID AGUNG PTZ,RUAS,Unidentified,112.7140478,-7.337617633,KOMINFO,SELATAN,HIKVISION,DS-2DY3320IW-DE
11,MASJID AGUNG TIMUR FIX,RUAS,Unidentified,"112,716,528","-7,337,077",KOMINFO,SELATAN,Unidentified,Unidentified
12,PAGESANGAN PTZ,RUAS,Jl. Pagesangan - Sepanjang Tani (perbatasan SBY- Sidoarjo),112.7055359,-7.336862594,TELKOM,SELATAN,HIKVISION,DS-2DY3320IW-DE
13,FR SIWALANKERTO UTARA FIX,SIMPANG,Frontage Siwalankerto hadap utara,112.7301018,-7.337260216,TELKOM,SELATAN,HIKVISION,DS-2DY3320IW-DE
14,FR SIWALANKERTO SELATAN FIX,SIMPANG,Frontage Siwalankerto hadap selatan,112.7300141,-7.337372867,TELKOM,SELATAN,HIKVISION,DS-2DY3320IW-DE
15,FR SIWALANKERTO PANO ,SIMPANG,Frontage Siwalankerto hadap,112.7301315,-7.337397891,TELKOM,SELATAN,HIKVISION,DS-2CD6986F-H
16,AHMAD YANI - SIWALANKERTO PTZ,RUAS,Ahmad Yani - Siwalankerto Hadap Selatan,"112,729,451","-7,337,379",KOMINFO,SELATAN,HIKVISION,DS-2DY3320IW-DE
17,FRONTAGE A YANI BRI JEMURSARI UTARA FIX,SIMPANG,Frontage Ahmad Yani Depan BRI Hadap Utara,112.7308197,-7.331287965,KOMINFO,SELATAN,HIKVISION,MVS-414232-IRMVF
18,A YANI PAPILIO UTARA FIX,SIMPANG,Ahmad Yani  Depan Hotel Papilio Hadap Utara,112.7310598,-7.331377662,KOMINFO,SELATAN,HIKVISION,MVS-414232-IRMVF
19,A YANI JEMUR ANDAYANI DOME,SIMPANG,Frontage Ahmad Yani Depan BRI Hadap Selatan,112.7309893,-7.331569514,KOMINFO,SELATAN,HIKVISION,MS-91021-IR-SD-OD
20,AHMAD YANI KEBONSARI SELATAN FIX,RUAS,Unidentified,"112,730,783","-7,329,768",TELKOM,Unidentified,Unidentified,Unidentified
21,A YANI TAMAN PELANGI PTZ,SIMPANG,A Yani Taman Pelangi arah masuk kota,112.7311182,-7.328297422,KOMINFO,SELATAN,HIKVISION,DS-2DY3320IW-DE
22,A YANI JEMURSARI PTZ,SIMPANG,A Yani jemursari arah luar kota,112.731593,-7.326489635,KOMINFO,SELATAN,HIKVISION,DS-2DY3320IW-DE
23,A YANI DOLOG PTZ,SIMPANG,A Yani  Dolog selatan pos polisi,112.731554,-7.32725011,KOMINFO,SELATAN,HIKVISION,DS-2DY3320IW-DE
24,A YANI DOLOG UTARA SPC,SIMPANG,A Yani  Dolog selatan pos polisi,"112,731,836","-7,326,571",KOMINFO,SELATAN,Unidentified,Unidentified
25,TAMAN PELANGI DOLOG PTZ,SIMPANG,Unidentified,"112,731,094","-7,326,518",KOMINFO,SELATAN,HIKVISION,DS-2DY3320IW-DE
26,PCTL A YANI DOLOG PTZ,RUAS,Unidentified,112.73223,-7.3246755,TELKOM,SELATAN,Unidentified,Unidentified
27,A YANI KFC PANO,SIMPANG,Simpang Ahmad Yani KFC Hadap Barat,"112,733,088","-7,319,190",KOMINFO,SELATAN,HIKVISION,DS-2DY3320IW-DE
28,A YANI KFC SELATAN PTZ,SIMPANG,Simpang Ahmad Yani KFC Hadap Selatan,"112,733,064","-7,319,230",KOMINFO,SELATAN,HIKVISION,DS-2DY3320IW-DE
29,A YANI KETINTANG BARU SELATAN PTZ,SIMPANG,Simpang Ahmad Yani Jalur Utama Hadap Selatan,"112,733,238","-7,319,249",KOMINFO,SELATAN,HIKVISION,DS-2DY3320IW-DE
30,A YANI MARGOREJO PTZ,SIMPANG,Simpang A. Yani - Margorejo (jalur hijau),112.733966,-7.316351945,KOMINFO,SELATAN,HIKVISION,DS-2DY3320IW-DE
31,A YANI MARGOREJO SELATAN FIX,SIMPANG,Simpang A. Yani - Margorejo (bando-hadap selatan),112.7338706,-7.316396936,KOMINFO,SELATAN,HIKVISION,DS.2CD7A85G0-IZSP/AI
32,A YANI MARGOREJO UTARA FIX,SIMPANG,Simpang A. Yani - Margorejo (bando-hadap utara),112.7340714,-7.316194657,KOMINFO,SELATAN,HIKVISION,DS.2CD7A85G0-IZSP/AI
33,A YANI MARGOREJO TIMUR FIX,SIMPANG,Simpang Ahmad Yani - Margorejo Hadap Timur,112.7343667,-7.316446009,KOMINFO,SELATAN,HIKVISION,DS-2CD8264F-EI 
34,FRONTAGE MARGOREJO UTARA FIX,SIMPANG,Simpang Ahmad Yani - Frontage Margorejo hadap utara,112.734247,-7.316228402,KOMINFO,SELATAN,HIKVISION,DS-2CD8264F-EI 
35,KETINTANG ROYAL PLAZA PANO,RUAS,Pertigaan Royal Plasa-Jl Ketintang,112.7350221,-7.310500355,TELKOM,SELATAN,HIKVISION,DS-2CD6986F-H
36,FRONTAGE RSAL PTZ,RUAS,Frontage A. Yani (RSAL) Hadap Selatan,112.736137,-7.307523,TELKOM,SELATAN,HIKVISION,DS-2DY3320IW-DE
37,A YANI MAYANGKARA DOME,SIMPANG,A Yani Mayangkara selatan layang mayangkara,112.7355771,-7.30832014,KOMINFO,SELATAN,MAGIC VISION,MV-90202-SD
38,WONOKROMO MAYANGKARA DOME,SIMPANG,Simpang A. Yani - Layang Mayangkara,112.7356435,-7.307341832,KOMINFO,SELATAN,MAGIC VISION,MV-91021-IR
39,WONOKROMO RSI DOME,RUAS,Wonokromo RSI Hadap Selatan,112.7355931,-7.306124744,TELKOM,SELATAN,MAGIC VISION,MVS-414232-IRMVF
40,UTURN FLYOVER MAYANGKARA,SIMPANG,Flyover mayangkara pos polisi hadap ,112.736678,-7.304514928,KOMINFO,SELATAN,HIKVISION,DS-2DY3320IW-DE
41,FLYOVER MAYANGKARA DOME,SIMPANG,Flyover mayangkara pos polisi hadap ,112.736678,-7.304514928,KOMINFO,SELATAN,MAGIC VISION,MV-91021-IR
42,WONOKROMO DTC TIMUR DOME,RUAS,Simpang Jl. Jagir - Jl. Wonokromo (sisi timur),112.7381331,-7.30301332,TELKOM,SELATAN,MAGIC VISION,MV-9048-812-SD
43,WONOKROMO DTC BARAT Hadap Utara PTZ,RUAS,Pintu masuk DTC Wonokromo Hadap Utara,"112,737,187","-7,301,415",TELKOM,SELATAN,HIKVISION,DS-2CD4232FWD-IZS
44,WONOKROMO DTC BARAT Hadap Selatan FIX,RUAS,Pintu masuk DTC Wonokromo Hadap Selatan,"112,737,187","-7,301,415",TELKOM,SELATAN,HIKVISION,DS-2DY3320IW-DE
45,JEMBATAN JOYOBOYO,RUAS,Jembatan Wonokromo Hadap Utara,"112,737,409","-7,300,634",TELKOM,SELATAN,HIKVISION,Unidentified
46,JEMBATAN WONOKROMO FIX,RUAS,Jembatan Wonokromo Hadap Selatan,"112,737,409","-7,300,634",TELKOM,SELATAN,HIKVISION,Unidentified
47,JOYOBOYO PTZ,RUAS,Depan Terminal Joyoboyo Hadap Utara,112.737653,-7.298447,TELKOM,SELATAN,HIKVISION,DS-2DY3320IW-DE
48,JEMBATAN SAWUNGGALING PTZ,RUAS,Jembatan Sawunggaling Hadap Utara,"112,737,373","-7,299,285",TELKOM,SELATAN,Unidentified,Unidentified
49,WARNING LIGHT JOYOBOYO FIX SPC,RUAS,Warning Light Depan Pintu Keluar Joyoboyo,112.7363848,-7.298504694,TELKOM,SELATAN,HIKVISION,DS-2DY3320IW-DE
50,JOYOBOYO BRAWIJAYA SELATAN PTZ,SIMPANG,Simpang Joyoboyo Brawijaya Hadap Selatan,"112,731,354","-7,299,301",TELKOM,SELATAN,HIKVISION,Unidentified
51,JOYOBOYO BRAWIJAYA BARAT PTZ,SIMPANG,Simpang Joyoboyo Brawijaya Hadap Barat,"112,731,354","-7,299,301",TELKOM,SELATAN,HIKVISION,Unidentified
52,JOYOBOYO BRAWIJAYA UTARA PTZ,SIMPANG,Simpang Joyoboyo Brawijaya Hadap Utara,"112,731,354","-7,299,301",TELKOM,SELATAN,HIKVISION,Unidentified
53,GN SARI GAJAH MADA DOME,SIMPANG,Simpang gunungsari - Gajahmada Hadap Barat,112.725689,-7.303904,KOMINFO,SELATAN,MAGIC VISION,DS-2DM1-612H
54,GN SARI GAJAH MADA BARAT FIX,SIMPANG,Unidentified,"112,725,530","-7,303,864",KOMINFO,SELATAN,Unidentified,Unidentified
55,GN.SARI PASAR IKAN PTZ,SIMPANG,Jl. Gunungsari(pasar ikan) Hadap Selatan,112.723935,-7.305869,KOMINFO,SELATAN,HIKVISION,DS-2DY3320IW-DE
56,GN.SARI ROLAK PTZ,SIMPANG,Simpang gunungsari-Rolak Hadap Selatan,112.719589,-7.307147,TELKOM,SELATAN,HIKVISION,DS-2DY3320IW-DE
57,GN.SARI ROLAK SELATAN FIX,SIMPANG,Simpang gunungsari-Rolak Hadap Utara,"112,718,868","-7,307,541",TELKOM,SELATAN,Unidentified,Unidentified
58,GN.SARI ROLAK BARAT FIX,SIMPANG,Simpang gunungsari-Rolak Hadap Selatan,"112,718,385","-7,307,307",TELKOM,SELATAN,Unidentified,Unidentified
59,GN.SARI SINGGASANA PTZ,SIMPANG,Simpang gunungsari-Hotel singgasana,112.716499,-7.307613,KOMINFO,SELATAN,HIKVISION,DS-2DY3320IW-DE
60,GN.SARI BUMI MARINIR DOME,SIMPANG,Simpang gunungsari-Marinir,112.714867,-7.307182,KOMINFO,SELATAN,MAGIC VISION,MV-91023-HD-OD
61,GUNUNGSARI EXIT TOL PERAK PTZ,SIMPANG,Simpang gunungsari-Akses Tol Hadap Barat,112.710835,-7.310475,KOMINFO,SELATAN,HIKVISION,DS-2DY3320IW-DE
62,GUNUNGSARI EXIT TOL MALANG PTZ,SIMPANG,Simpang gunungsari-Akses tol malang Hadap Timur,112.711595,-7.309108,KOMINFO,SELATAN,HIKVISION,DS-2DY3320IW-DE
63,MASTRIP WIYUNG PTZ,SIMPANG,Simpang gunungsari-Mastrip-wiyung,112.709718,-7.312852,KOMINFO,SELATAN,HIKVISION,DS-2DY3320IW-DE
64,SDN JAJAR TUNGGAL WIYUNG PANO,OBJEK VITAL,SDN Jajar Tunggal Wiyung,112.7003275,-7.313805671,TELKOM,SELATAN,HIKVISION,DS-2CD6986F-H
65,GEREJA GKJW WIYUNG PTZ,OBJEK VITAL,Gereja Depan Kecamatan Wiyung,112.6954837,-7.313761841,TELKOM,SELATAN,HIKVISION,DS-2CD6986F-H
66,SDN WIYUNG 1 PANO,OBJEK VITAL,Jl. Wiyung (SDN Wiyung),112.6947441,-7.314033418,TELKOM,SELATAN,HIKVISION,DS-2CD6986F-H
67,KARANGPILANG WONOCOLO UTARA FIX,SIMPANG,Simpang karangpilang Wonocolo Hadap Utara,"112,694,745","-7,342,623",TELKOM,SELATAN,HIKVISION,DS-2CD3T45G0-4I/SP
68,KARANGPILANG WONOCOLO SELATAN FIX,SIMPANG,Simpang karangpilang Wonocolo Hadap Selatan,"112,694,809","-7,342,535",TELKOM,SELATAN,HIKVISION,DS-2CD3T45G0-4I/SP
69,KARANGPILANG WONOCOLO TIMUR FIX,SIMPANG,Simpang karangpilang Wonocolo Hadap Timur,"112,694,665","-7,342,570",TELKOM,SELATAN,HIKVISION,DS-2CD3T45G0-4I/SP
70,JEMURSARI NGAWINAN DOME,RUAS,PCTL Jemur Ngawina Hadap Barat,"112,734,741","-7,327,582",TELKOM,SELATAN,MAGIC VISION,MS-91021-IR-SD-OD
71,JEMURSARI JEMUR ANDAYANI BARAT FIX,SIMPANG,Simpang Jemursari Jemur Andayani Hadap Barat,112.735439,-7.327514,TELKOM,SELATAN,HIKVISION,MVS-414232-IRMVF
72,JEMURSARI - JEMUR ANDAYANI PTZ,SIMPANG,Simpang Jemursari Jemur Andayani Hadap Timur,112.735648,-7.327487,TELKOM,SELATAN,HIKVISION,DS-2DY3320IW-DE
73,JEMUR KUTISARI BARAT FIX,SIMPANG,Jemur Kutisari Hadap Barat,112.7424369,-7.329074969,TELKOM,SELATAN,HIKVISION,DS-2CD7A85G0-IZSP/AI
74,JEMUR KUTISARI TIMUR FIX,SIMPANG,Jemur Kutisari Hadap Timur,112.7425825,-7.329051815,TELKOM,SELATAN,HIKVISION,MVS-414232-IRMVF
75,JEMURSARI TENGGILIS TIMUR FIX,SIMPANG,Simpang Jemursari Tenggilis Hadap Timur,112.7462975,-7.320929157,TELKOM,SELATAN,HIKVISION,MVS-414232-IRMVF
76,JEMURSARI TENGGILIS UTARA FIX,SIMPANG,Simpang Jemursari Tenggilis Hadap Utara,112.7462884,-7.320992983,TELKOM,SELATAN,HIKVISION,MV-41033-3D-IRWP
77,JEMURSARI TENGGILIS DOME,SIMPANG,Simpang Jemursari Tenggilis Hadap Utara,112.7456362,-7.321037398,TELKOM,SELATAN,MAGIC VISION,MV-91021-IR-SD-OD
78,KENDANGSARI TENGGILIS PANO,SIMPANG,Simpang Kendangsar Tenggilis Kimia Farma Hadap Barat,112.7500358,-7.321132685,TELKOM,SELATAN,HIKVISION,DS-2DY3320IW-DE
79,KENDANGSARI TENGGILIS SELATAN PTZ,SIMPANG,Simpang Kendangsar Tenggilis Kimia Farma Hadap Selatan,112.7498506,-7.321154976,TELKOM,SELATAN,HIKVISION,DS-2DY3320IW-DE
80,KENDANGSARI TENGGILIS TIMUR SPC,SIMPANG,Simpang Kendangsar Tenggilis Kimia Farma Hadap Timur,112.7498757,-7.321196181,TELKOM,SELATAN,SPC,DS-2DY3320IW-DE
81,MARGOREJO PRAPEN SELATAN FIX,SIMPANG,Simpang Margorejo Prapen Hadap Selatan,112.7512473,-7.317745781,TELKOM,SELATAN,HIKVISION,DS-2CD2632F-IS
82,MARGOREJO PRAPEN DOME,SIMPANG,Simpang Margorejo Prapen Hadap Utara,112.7511988,-7.317682777,TELKOM,SELATAN,MAGIC VISION,MS-91021-IR-SD-OD
83,MARGOREJO PRAPEN UTARA FIX,SIMPANG,Simpang Margorejo Prapen Hadap Utara,112.7514503,-7.317685936,TELKOM,SELATAN,HIKVISION,DS-2CD2642FWD-I
84,SDN TENGGILIS MEJOYO  1  PANO,OBJEK VITAL,SDN Tenggilis Mejoyo 1,112.754119,-7.315550127,TELKOM,SELATAN,HIKVISION,DS-2CD6986F-H
85,JAGIR WONOKROMO PTZ,SIMPANG,Simpang Jl. Jagir - Jl. Stasiun Wonokromo,"112,739,737","-7,300,692",KOMINFO,SELATAN,HIKVISION,DS-2DY3320IW-DE
86,JAGIR WONOKROMO BARAT FIX,SIMPANG,Simpang Jl. Jagir - Jl. Stasiun Wonokromo hadap barat,"112,739,722","-7,300,697",KOMINFO,SELATAN,HIKVISION,DS-2CD4232FWD-IZS
87,JAGIR WONOKROMO UTARA FIX,SIMPANG,Simpang Jl. Jagir - Jl. Stasiun Wonokromo hadap utara,"112,739,860","-7,300,699",KOMINFO,SELATAN,HIKVISION,DS-2CD4232FWD-IZS
88,JAGIR WONOKROMO SELATAN FIX,SIMPANG,Simpang Jl. Jagir - Jl. Stasiun Wonokromo hadap selatan,"112,739,741","-7,300,742",KOMINFO,SELATAN,HIKVISION,DS-2CD4232FWD-IZS
89,BRATANG BARATA JAYA SELATAN FIX,SIMPANG,Simpang Bratang - Barata Jaya Hadap Selatan,112.7596376,-7.29919722,KOMINFO,SELATAN,HIKVISION,MVS-414232-IRMVF
90,BRATANG BARATA JAYA BARAT FIX,SIMPANG,Simpang Bratang - Barata Jaya Hadap Barat,112.7595264,-7.299018878,KOMINFO,SELATAN,HIKVISION,MVS-414232-IRMVF
91,BRATANG BARATA JAYA UTARA FIX,SIMPANG,Simpang Bratang - Barata Jaya Hadap Utara,112.7596805,-7.298915499,KOMINFO,SELATAN,HIKVISION,MVS-414232-IRMVF
92,BRATANG BARATA JAYA TIMUR FIX,SIMPANG,Simpang Bratang - Barata Jaya Hadap Timur,112.7598165,-7.299095066,KOMINFO,SELATAN,HIKVISION,MVS-414232-IRMVF
93,BRATANG BINANGUN DOME,SIMPANG,Simpang Bratang - Barata Jaya Hadap Utara,112.759727,-7.299180368,KOMINFO,SELATAN,MAGIC VISION,MS-91021-IR-SD-OD
94,SD BARATA JAYA PANO,OBJEK VITAL,SD Barata Jaya - PCTL BARATA JAYA,112.7595174,-7.300776855,TELKOM,SELATAN,HIKVISION,DS-2CD6986F-H
95,BRATANG - KRUKAH PTZ,SIMPANG,Simpang Bratang - Krukah Hadap Selatan,"112,755,893","-7,298,521",KOMINFO,SELATAN,HIKVISION,DS-2DY3320IW-DE
96,DARMOKALI BENGAWAN BARAT FIX,SIMPANG,Simpang Darmokali Bengawan  Hadap Barat,"112,742,255","-7,290,948",TELKOM,SELATAN,Unidentified,Unidentified
97,DARMOKALI BENGAWAN SELATAN FIX,SIMPANG,Simpang Darmokali Bengawan  Hadap Selatan,112.7423432,-7.291008652,TELKOM,SELATAN,HIKVISION,DS-2DY3320IW-DE
98,DARMOKALI BENGAWAN TIMUR FIX,SIMPANG,Simpang Darmokali Bengawan  Hadap Timur,112.7421245,-7.290878371,TELKOM,SELATAN,HIKVISION,DS-2CD4232FWD-IZ
99,NGAGEL UJUNG GALUH UTARA PTZ,SIMPANG,Ngagel Ujung Galuh Depan Transmart Hadap Utara,112.74295,-7.291298,TELKOM,SELATAN,HIKVISION,DS-2DY3320IW-DE
100,NGAGEL UJUNG GALUH SELATAN SPC,SIMPANG,Ngagel Ujung Galuh Depan Transmart Hadap Selatan,112.74295,-7.291298,TELKOM,SELATAN,HIKVISION,DS-2DY3320IW-DE
101,NGAGEL JAYA NGAGEL MADYA UTARA FIX,SIMPANG,Simpang Ngagel Jaya Selatan - Ngagel Madya (hadap Utara),112.760154,-7.293774201,TELKOM,SELATAN,HIKVISION,DS-2CD4A26FWD-IZ
102,NGAGEL MADYA RMI DOME,SIMPANG,Simpang Ngagel Jaya Selatan - Ngagel Madya (hadap Barat),112.7599343,-7.293887886,TELKOM,SELATAN,MAGIC VISION,MS-91021-IR-SD-OD
103,NGAGEL JAYA SELATAN MADYA TIMUR FIX,SIMPANG,Simpang Ngagel Jaya Selatan - Ngagel Madya (hadap timur),112.7597962,-7.293670621,TELKOM,SELATAN,HIKVISION,MVS-414232-IRMVF
104,NGAGEL JAYA SELATAN MADYA BARAT FIX,SIMPANG,Simpang Ngagel Jaya Selatan - Ngagel Madya (hadap timur),112.7600009,-7.293527049,TELKOM,SELATAN,HIKVISION,MVS-414232-IRMVF
105,NGAGEL BAT DINOYO TIMUR PTZ,SIMPANG,Simpang Ngagel - Bung Tomo (BAT Pos Polisi) Hadap Barat,112.7446759,-7.28878138,TELKOM,SELATAN,HIKVISION,DS-2DY3320IW-DE
106,DINOYO - NGAGEL BAT FIX SELATAN FIX,SIMPANG,Ngagel BAT Depan Marvell City Hadap Selatan,112.7438545,-7.288615099,TELKOM,SELATAN,HIKVISION,MVS-414232-IRMVF
107,DINOYO BAT DOME,SIMPANG,Dinoyo Jembatan BAT Hadap Timur,112.7439073,-7.288483318,TELKOM,SELATAN,MAGIC VISION,MS-91021-IR-SD-OD
108,NGAGEL UPAJIWA BARAT FIX,SIMPANG,Simpang Ngagel UpaJiwa Hadap Timur,112.7463494,-7.290557133,TELKOM,SELATAN,HIKVISION,MVS-414232-IRMVF
109,NGAGEL UPAJIWA TIMUR  FIX,SIMPANG,Simpang Ngagel UpaJiwa Hadap Barat,112.7461358,-7.290291514,TELKOM,SELATAN,HIKVISION,MVS-414232-IRMVF
110,NGAGEL JAYA UTARA GEREJA SELATAN PTZ,SIMPANG,Simpang Ngagel Jaya Utara Gereja Hadap Selatan,112.7600269,-7.28909656,TELKOM,SELATAN,HIKVISION,DS-2DY3320IW-DE
111,NGAGEL JAYA UTARA GEREJA UTARA FIX,SIMPANG,Simpang Ngagel Jaya Utara Gereja Hadap Utara,112.7599708,-7.289418413,TELKOM,SELATAN,HIKVISION,DS-2DY3320IW-DE
112,NGAGEL JAYA UTARA GEREJA TIMUR PTZ,SIMPANG,Simpang Ngagel Jaya Utara Gereja Hadap Timur,112.7601045,-7.289336102,TELKOM,SELATAN,HIKVISION,DS-2DY3320IW-DE
113,NGAGEL JAYA UTARA GEREJA PANO,SIMPANG,Simpang Ngagel Jaya Utara Gereja Hadap Tengah,112.7598818,-7.289295377,TELKOM,SELATAN,HIKVISION,DS-2CD6986F-H
114,MANYAR NGAGEL BARAT FIX,SIMPANG,Manyar Ngagel LP3I Hadap Barat,112.7625008,-7.293564031,KOMINFO,SELATAN,HIKVISION,DS-2CD4232FWD-IZS
115,MANYAR NGAGEL UTARA FIX,SIMPANG,Manyar Ngagel LP3I Hadap Utara,112.7622265,-7.293691252,KOMINFO,SELATAN,HIKVISION,DS-2CD4A26FWD-IZ
116,MANYAR NGAGEL TIMUR FIX,SIMPANG,Manyar Ngagel LP3I Hadap Timur,112.7623451,-7.293851445,KOMINFO,SELATAN,HIKVISION,DS-2CD4A26FWD-IZ
117,MANYAR NGAGEL SELATAN PTZ,SIMPANG,Manyar Ngagel LP3I Hadap Selatan,112.7622755,-7.293853123,KOMINFO,SELATAN,HIKVISION,DS-2DY3320IW-DE
118,RUNGKUT KIDUL BARAT PTZ,SIMPANG,Simpang Rungkut Kidul Hadap Barat,112.7686095,-7.330925881,TELKOM,SELATAN,HIKVISION,DS-2DY3320IW-DE
119,RUNGKUT KIDUL UTARA PTZ,SIMPANG,Simpang Rungkut Kidul Hadap Utara,112.7687401,-7.33083916,TELKOM,SELATAN,HIKVISION,DS-2DY3320IW-DE
120,RUNGKUT KIDUL TIMUR PTZ,SIMPANG,Simpang Rungkut Kidul Hadap Timur,112.7688424,-7.331270032,TELKOM,SELATAN,HIKVISION,DS-2DY3320IW-DE
121,RUNGKUT ALANG-ALANG UTARA PTZ,SIMPANG,Simpang Rungkut Alang - Alang Hadap Utara,112.7696502,-7.322519971,TELKOM,SELATAN,HIKVISION,DS-2DY3320IW-DE
122,RUNGKUT ALANG-ALANG SELATAN PTZ,SIMPANG,Simpang Rungkut Alang - Alang Hadap Selatan,112.7697523,-7.322160751,TELKOM,SELATAN,HIKVISION,DS-2DY3320IW-DE
123,RUNGKUT ALANG-ALANG TIMUR PTZ,SIMPANG,Simpang Rungkut Alang - Alang Hadap Timur,112.7696322,-7.322408574,TELKOM,SELATAN,HIKVISION,DS-2DY3320IW-DE
124,A YANI KETINTANG BARU PANO,SIMPANG,Simpang Ahmad Yani Jalur Utama Pano,"112,733,310","-7,319,229",KOMINFO,SELATAN,HIKVISION,DS-2CD6986F-H
125,BANGKINGAN - SUMUR WELUT TIMUR PTZ,SIMPANG,Simpang Jl. Bangkingan - Jl. Sumur Welut Hadap Timur,"112,650,582","-7,323,587",TELKOM,SELATAN,HIKVISION,DS-2DY3320IW-DE
126,PERTIGAAN MARMOYO PTZ,RUAS,Jl. Darmo - Jl. Marmoyo,"112,739,484","-7,296,811",TELKOM,SELATAN,Unidentified,Unidentified
127,AHMAD YANI KEJATI PTZ,RUAS,Jl. Ahmad Yani Seberang Kejati,"112,734,656","-7,313,555",TELKOM,SELATAN,Unidentified,Unidentified
128,KARAH PTZ,SIMPANG,Unidentified,112.7195775,-7.3090327,TELKOM,SELATAN,HIKVISION,Unidentified
,,,,,,,,,
129,DIPONEGORO CILIWUNG UTARA PTZ,SIMPANG, Jl. Diponegoro - Ciliwung Hadap Utara,112.7372262,-7.292518904,KOMINFO,BARAT,HIKVISION,DS-2CD2642FWD-I
130,DIPONEGORO CILIWUNG BARAT PTZ,SIMPANG, Jl. Diponegoro - Ciliwung Hadap Barat,112.7369727,-7.292378389,KOMINFO,BARAT,HIKVISION,DS-2CD2642FWD-I
131,DIPONEGORO CILIWUNG SELATAN FIX,SIMPANG, Jl. Diponegoro - Ciliwung Hadap Selatan,112.7372079,-7.29196228,KOMINFO,BARAT,HIKVISION,DS-2DY3320IW-DE
132,DIPONEGORO KUTAI  PANO,SIMPANG,Simpang Diponegoro - Kutei,112.7362316,-7.290368627,KOMINFO,BARAT,HIKVISION,DS-2CD6986F-H
133,DIPONEGORO KUTAI TIMUR FIX,SIMPANG,Simpang Diponegoro - Kutei Hadap Barat,112.7360114,-7.290269188,KOMINFO,BARAT,MAGIC VISION,MVS-414232-IRMVF
134,DIPONEGORO MUSI UTARA PTZ,SIMPANG,Simpang Diponegoro - Musi Hadap Utara,112.7342724,-7.286213741,KOMINFO,BARAT,HIKVISION,DS-2CD4232FWD-IZS
135,DIPONEGORO MUSI SELATAN FIX,SIMPANG,Simpang Diponegoro - Musi Hadap Selatan,112.7342484,-7.286472677,KOMINFO,BARAT,HIKVISION,DS-2CD4232FWD-IZS
136,DIPONEGORO MUSI DOME  ,SIMPANG,Simpang Diponegoro - Musi Dome Hadap Utara,112.7342796,-7.286372479,KOMINFO,BARAT,MAGIC VISION,MV-9048-812-SD
137,MUSI OPAK BARAT PTZ,SIMPANG,Simpang Jl. Musi - Jl. Opak Hadap Barat,112.7333374,-7.28682313,TELKOM,BARAT,HIKVISION,DS-2DY3320IW-DE
138,INDRAGIRI GOR PTZ,SIMPANG,Simpang Jl. Indragiri - Jl. Musi FIX 1,112.7316004,-7.287776051,TELKOM,BARAT,HIKVISION,DS-2DY3320IW-DE
139,DIPONEGORO SOETOMO TIMUR FIX,SIMPANG,Simpang Diponegoro - Dr. Soetomo Hadap Timur,112.7331874,-7.284602945,KOMINFO,BARAT,HIKVISION,DS-2DY3320IW-DE
140,DIPONEGORO SOETOMO SELATAN FIX,SIMPANG,Simpang Diponegoro - Dr. Soetomo Hadap Selatan,"112,733,338","-7,284,595",KOMINFO,BARAT,Unidentified,Unidentified
141,DIPONEGORO SOETOMO UTARA FIX,SIMPANG,Simpang Diponegoro - Dr. Soetomo Hadap Utara,"112,733,402","-7,284,340",KOMINFO,BARAT,Unidentified,Unidentified
142,DIPONEGORO KARTINI PTZ,SIMPANG,Simpang Jl Diponegoro - jl Kartini Arah Keluar Kota,112.729201,-7.278062,KOMINFO,BARAT,MAGIC VISION,MV-91021-IR-SD-OD
143,BANYU URIP POSPOL PTZ,SIMPANG,Simpang Jl. Diponegoro - Ps Kembang - Banyu Urip (pos polisi)  Hadap Barat,"112,726,695","-7,274,829",KOMINFO,BARAT,HIKVISION,DS-2DY3320IW-DE
144,BANYU URIP PUTAT PTZ ,SIMPANG,Simpang Banyu Urip - Girilaya Hadap Timur,"112,726,196","-7,274,834",TELKOM,BARAT,HIKVISION,DS-2DY3320IW-DE
145,BANYU URIP TOKO EMAS PTZ,SIMPANG,Simpang Jl. Diponegoro - Ps Kembang - Banyu Urip (Toko Emas),"112,726,929","-7,275,089",TELKOM,BARAT,HIKVISION,DS-2DY3320IW-DE
146,PASAR KEMBANG ARJUNO PTZ,SIMPANG,Simpang Kedungdoro Arjuno Hadap Selatan,112.729069,-7.268724,KOMINFO,BARAT,HIKVISION,DS-2DY3320IW-DE
147,KEDUNGDORO KEDUNGSARI PTZ,SIMPANG,Simpang Kedungdoro - Kedungsari Hadap Timur,112.730242,-7.26554,KOMINFO,BARAT,HIKVISION,DS-2DY3320IW-DE
148,KEDUNGDORO KEDUNGSARI SELATAN FIX,SIMPANG,Simpang Kedungdoro - Kedungsari Hadap Selatan,"112,730,234","-7,265,568",KOMINFO,BARAT,Unidentified,Unidentified
149,BANYU URIP TOL SELATAN FIX,SIMPANG,Banyu urip Tol Simokalangan Hadap Barat,"112,707,140","-7,266,119",TELKOM,BARAT,HIKVISION,DS-2DY3320IW-DE
150,BANYU URIP TOL BARAT FIX,SIMPANG,Banyu urip Tol Simokalangan Hadap Timur,"112,707,139","-7,266,268",TELKOM,BARAT,HIKVISION,DS-2DY3320IW-DE
151,BANYU URIP TOL TIMUR FIX,SIMPANG,Banyu urip Tol Simokalangan Hadap Utara,"112,706,981","-7,266,134",TELKOM,BARAT,HIKVISION,DS-2DY3320IW-DE
152,SUKOMANUNGGAL SATELITE BARAT FIX,SIMPANG,Simpang Sukomanunggal Satelite Hadap Utara,112.6949481,-7.262576442,TELKOM,BARAT,HIKVISION,DS-2DY3320IW-DE
153,SUKOMANUNGGAL SATELITE TIMUR FIX,SIMPANG,Simpang Sukomanunggal Satelite Hadap Timur,112.6951777,-7.262814838,TELKOM,BARAT,HIKVISION,DS-2DY3320IW-DE
154,SUKOMANUNGGAL SATELITE SELATAN FIX,SIMPANG,Simpang Sukomanunggal Satelite Hadap Selatan,112.6950342,-7.262757975,TELKOM,BARAT,HIKVISION,DS-2DY3320IW-DE
155,SUKOMANUNGGAL SATELITE PANO,SIMPANG,Simpang Sukomanunggal Satelite,112.6951484,-7.262612288,TELKOM,BARAT,HIKVISION,DS-2CD6986F-H
156,TANDES - TANJUNGSARI DOME,SIMPANG,Simpang Tandes -  Tanjungsari,"112,692,089","-7,260,766",TELKOM,BARAT,VIVOTEK,VIVOTEK
157,TANDES - TANJUNGSARI BARAT PTZ,SIMPANG,Simpang Tandes -  Tanjungsari Hadap Barat,"112,692,300","-7,260,745",TELKOM,BARAT,HIKVISION,DS-2DY3320IW-DE
158,TANDES - TANJUNGSARI UTARA FIX,SIMPANG,Simpang Tandes -  Tanjungsari Hadap Utara,"112,692,365","-7,260,629",TELKOM,BARAT,HIKVISION,DS-2CD4232FWD-IZS
159,TANDES IMIGRASI BARAT FIX,SIMPANG,Simpang Jl. Raya Darmo Indah Selatan - Jl. Tandes Hadap Barat,"112,684,871","-7,259,171",TELKOM,BARAT,HIKVISION,DS-2CD3T45G0-4I/SP
160,TANDES IMIGRASI SELATAN FIX,SIMPANG,Simpang Jl. Raya Darmo Indah Selatan - Jl. Tandes Hadap Selatan,"112,684,908","-7,259,136",TELKOM,BARAT,HIKVISION,DS-2CD3T45G0-4I/SP
161,TANDES IMIGRASI TIMUR FIX,SIMPANG,Simpang Jl. Raya Darmo Indah Selatan - Jl. Tandes Hadap Timur,"112,685,027","-7,259,283",TELKOM,BARAT,HIKVISION,DS-2CD3T45G0-4I/SP
162,KYAI AMIR PANO,SIMPANG,Simpang Kyai Amir - Manukan,"112,668,591","-7,257,186",TELKOM,BARAT,Unidentified,Unidentified
163,KYAI AMIR TIMUR PTZ,SIMPANG,Simpang Kyai Amir - Manukan Hadap Timur,"112,668,614","-7,257,215",TELKOM,BARAT,Unidentified,Unidentified
164,KYAI AMIR BARAT PTZ,SIMPANG,Simpang Kyai Amir - Manukan Hadap Barat,"112,668,519","-7,257,134",TELKOM,BARAT,Unidentified,Unidentified
165,KYAI AMIR SELATAN PTZ,SIMPANG,Simpang Kyai Amir - Manukan Hadap Selatan,"112,668,551","-7,257,185",TELKOM,BARAT,Unidentified,Unidentified
166,SEMEMI RS BDH PANO,SIMPANG,Simpang Jl. Raya Sememi - Jl. Kendung (arah RS BDH),112.636342,-7.24611397,TELKOM,BARAT,HIKVISION,DS-2CD6986F-H
167,SDN BENOWO 1 PANO,OBJEK VITAL,Jl. Raya Benowo (SDN Benowo),112.6092879,-7.235535973,TELKOM,BARAT,HIKVISION,DS-2CD6986F-H
168,TERMINAL MANUKAN FIX,OBJEK VITAL,Terminal Manukan,"112,666,130","-7,268,306",TELKOM,BARAT,Unidentified,Unidentified
169,ADITYAWARMAN INDRAGIRI PTZ,SIMPANG,Simpang Adityawarman - Indragiri Hadap Barat,112.7298657,-7.29297096,KOMINFO,BARAT,MAGIC VISION,MV-9048-812-SD
170,ADITYAWARMAN INDRAGIRI BARAT FIX,SIMPANG,Simpang Adityawarman - Indragiri Hadap Barat,112.7295802,-7.292762364,KOMINFO,BARAT,MAGIC VISION,MVS-414232-IRMVF
171,ADITYAWARMAN INRAGIRI UTARA FIX,SIMPANG,Simpang Adityawarman - Indragiri Hadap Utara,112.7298266,-7.293044808,KOMINFO,BARAT,MAGIC VISION,MVS-414232-IRMVF
172,ADITYAWARMAN INRAGIRI TIMUR FIX ,SIMPANG,Simpang Adityawarman - Indragiri Hadap Timur,112.729889,-7.292717169,KOMINFO,BARAT,MAGIC VISION,MVS-414232-IRMVF
173,MAYJEND SUNGKONO DIPONGGO PANO,SIMPANG,Simpang mAyjend Sungkono - Bintang Diponggo,112.7188462,-7.291887355,KOMINFO,BARAT,HIKVISION,DS-2CD6986F-H
174,MAYJEND SUNGKONO CIWO BARAT FIX ,SIMPANG,Simpang Mayjend Sungkono - Bintang Diponggo Hadap Barat,112.7186866,-7.291684153,KOMINFO,BARAT,HIKVISION,MVS-414232-IRMVF
175,MAYJEND SUNGKONO DIPONGGO UTARA FIX,SIMPANG,Simpang Mayjend Sungkono - Bintang Diponggo Hadap Utara,112.7190002,-7.29178829,KOMINFO,BARAT,MAGIC VISION,MVS-414232-IRMVF
176,MAYJEND SUNGKONO CIWO TIMUR FIX ,SIMPANG,Simpang Mayjend Sungkono - Bintang Diponggo Hadap Timur,112.7188462,-7.291887355,KOMINFO,BARAT,HIKVISION,Unidentified
177,MAYJEND SUNGKONO TVRI PANO,SIMPANG,Simpang  Mayjen Sungkono - Jl. Dukuh Kupang (depan TVRI),112.7135438,-7.290546674,KOMINFO,BARAT,HIKVISION,DS-2CD6986F-H
178,MAYJEND SUNGKONO TVRI BARAT FIX,SIMPANG,Simpang  Mayjen Sungkono - Jl. Dukuh Kupang (depan TVRI) Hadap Barat,112.7132773,-7.290285641,KOMINFO,BARAT,MAGIC VISION,MVS-414232-IRMVF
